handleId,fieldType,name,description,productImageUrl,collection,sku,ribbon,price,surcharge,visible,discountMode,discountValue,inventory,weight,productOptionName1,productOptionType1,productOptionDescription1,productOptionName2,productOptionType2,productOptionDescription2,productOptionName3,productOptionType3,productOptionDescription3,productOptionName4,productOptionType4,productOptionDescription4,productOptionName5,productOptionType5,productOptionDescription5,productOptionName6,productOptionType6,productOptionDescription6,additionalInfoTitle1,additionalInfoDescription1,additionalInfoTitle2,additionalInfoDescription2,additionalInfoTitle3,additionalInfoDescription3,additionalInfoTitle4,additionalInfoDescription4,additionalInfoTitle5,additionalInfoDescription5,additionalInfoTitle6,additionalInfoDescription6,customTextField1,customTextCharLimit1,customTextMandatory1,brand
product_0,Product,Ankaflex Unisex Siyah Medikal Korse Ortopedik Kamburluk Önleyici Sırt Dik Duruş Korsesi OPTMNYTK049,"15 gün içinde ücretsiz iade. Detaylı bilgi için tıklayın.

Bu ürün Optimum Mağaza tarafından gönderilecektir.
Dik duruş korsesi bel sırt ağrısı destek kamburluk önlemek için korse omurga postur düzeltici aparat Ankaflex manyetik dik duruş korsesi ayarlanabilir bel sırt omuz germe yeleği ortopedik sırtlık korse Kısa zamanda doğru pozisyonlarda hareket etmeyi sağlayacak sırt, boyun ve omurga kaslarınızı da güçlendirerek kas hafızasının gelişmesinde, sırt ağrılarını azaltmada ve fizik tedaviye yardımcı olarak en etkili manyetik dik durma korsesidir. Sırt bölgesinde içerdiği 9 adet manyetik mıknatısın sağladığı terapi bel ve omuz ağrısının hafiflemesine yardımcı olur. Omuzları hafifçe geri çekerek ve omurgayı 360 derece destekleyerek omuz ve belin doğru duruş şeklini korur, günlük hayatta otururken, araç kullanırken ya da ayakta yanlış duruş şekline bağlı olarak ortaya çıkabilecek kamburluğu önlemeye yardımcı olur. Vücudun dik durma şeklini korumasıyla daha genç bir görünüm sağlar. Bel ve omuzda bulunan ayarlanabilir kemerler ile rahat bir şekilde hem erkekler hem de kadınlar tarafından rahatlıkla kullanılabilir. Neopren yapısı sayesinde sırtınızı doğru konumda tutacak kadar güçlüdür. Dikkat türk patent ve marka kurumu tarafından tıbbi ortopedik malzemeler alanında tescil edilmiş ankaflex Markalı üründür. Taklitlerinden ve merdiven altı üretim satanlardan sakınınız. * rahat ve esnek * fizik tedavi sağlar * vücut duruşunu etkin iyileştirme * ayarlanabilir kemerler",https://cdn.dsmcdn.com/mnresize/128/192/ty22/product/media/images/20201106/11/22986475/101687241/1/1_org_zoom.jpg,2/ All Clothes,,,129.95,,FALSE,PERCENT,0,InStock,0,,,,,,,,,,,,,,,,,,,,,,,,,,,,,,,,,,
product_0,Product,Yıldız İç Giyim 2001 Erkek Penye Atlet Beyaz CİHAN 2001,"15 gün içinde ücretsiz iade. Detaylı bilgi için tıklayın.

Bu ürün giyimsepeti tarafından gönderilecektir.
Cihan 2001 erkek penye atlet /beyaz/m
Bu üründen en fazla 10 adet sipariş verilebilir. 10 adetin üzerindeki siparişleri Trendyol iptal etme hakkını saklı tutar.
Kampanya fiyatından satılmak üzere 100 adetten fazla stok sunulmuştur.
İncelemiş olduğunuz ürünün satış fiyatını satıcı belirlemektedir.
Bir ürün birden fazla satıcı tarafından satılabilir. Ürün liste ve detay sayfalarında tüketici memnuniyeti göz önüne alınarak fiyat avantajı, teslimat hızı, iade oranları ve genel hizmet kalitesine göre belirlenmiş puanı en yüksek satıcı görünür satıcı olur. Diğer satıcılar, ürün detay sayfasında alternatif olarak listelenirler.",https://cdn.dsmcdn.com/ty224/product/media/images/20211103/16/164984013/249528287/1/1_org_zoom.jpg,2/ All Clothes,,,28.79,,FALSE,PERCENT,0,InStock,0,Size,DROP_DOWN,S;M;L;XL,,,,,,,,,,,,,,,,,,,,,,,,,,,,,,,
product_1,Product,Termal Sauna Zayıflama İncelme Yağ Yakma Takımı Fermuarlı Yarım Kol Termal Tayt zayıflamakıyafeti,"15 gün içinde ücretsiz iade. Detaylı bilgi için tıklayın.

Bu ürün TERMAL SHOWROOM tarafından gönderilecektir.
Ürün Termal Tayt ve Yarım Kollu Fermuarlı Üst Olmak Üzere İki Parçadır.
Polimer Kumaştan Üretilmiştir.
Vücut ısısını içerde hapsederek terlemenizi ve yağ yakım oranınızı hızlandırır.
Bel, basen, göbek ve bacak çevresinde kısa sürede etkili incelme sağlar.
Spor Yaparken veya hareket halinde Terlemenize Yardımcı Olur.
S BEDEN 50-60 Kilo Bel 70-77 Cm Basen 87-92 Cm",https://cdn.dsmcdn.com/mnresize/128/192/ty184/product/media/images/20210926/14/136388514/132949922/1/1_org_zoom.jpg,2/ All Clothes,,,199.9,,FALSE,PERCENT,0,InStock,0,Size,DROP_DOWN,S;M;L;XL;2XL;3XL,,,,,,,,,,,,,,,,,,,,,,,,,,,,,,,
